{
  "version": "1.0.0",
  "project": {
    "name": "Locked Contracts Reference",
    "authoring_tool": "Tachyon Group A",
    "root_seed": 123456789
  },
  "assets": [
    {
      "id": "bg_001",
      "type": "image",
      "path": "assets/background.png",
      "alpha_mode": "premultiplied"
    }
  ],
  "compositions": [
    {
      "id": "main_comp",
      "name": "Handoff Test",
      "width": 1920,
      "height": 1080,
      "fps": 24,
      "duration": 5.0,
      "layers": [
        {
          "id": "layer_001",
          "name": "Background",
          "type": "image",
          "transform": {
            "position": [960, 540, 0],
            "rotation": [0, 0, 0],
            "scale": [1, 1, 1],
            "anchor_point": [960, 540, 0],
            "opacity": 1.0
          }
        }
      ]
    }
  ]
}
